<?xml version="1.0"?>
<DataDesc xmlns:xsi="http://www.w3.org/2001/XMLSchema-instance" xsi:schemaLocation="file:// ../../Xml/schemas/SensorData.xsd">
  <group name="Instant">
    <groupArray count="4">
      <group name="Channel">
        <array type="float" count="4">tmp</array>
        <array type="float" count="4">prs</array>
        <array type="float" count="4">ro</array>
        <array type="float" count="4">hent</array>
        <array type="float" count="4">rshv</array>
        <array type="float" count="4">rshm</array>
        <array type="float" count="4">pwr</array>
      </group>
    </groupArray>
  </group>
 
 <group name="Integrated">
    <uint32>T_Rab</uint32>
    <uint32>T_offline</uint32>
    <groupArray count="4">
      <group name="Channel">
        <double>intV</double>
        <double>intM</double>
        <double>intQ</double>
        <double>intQErr</double>
        <uint32>T_Nar</uint32>
        <uint32>T_Max</uint32>
        <uint32>T_Min</uint32>
        <uint32>T_dt</uint32>
        <uint32>T_tn</uint32>
        <uint32>T_rev</uint32>
        <uint32>T_pt</uint32>
        <uint8>tekerr</uint8>
        <uint8>teherr</uint8>
        <array type="uint16" count="3" >t</array>
        <array type="uint16" count="3">p</array>
      </group>
    </groupArray>
  </group>
</DataDesc>