<?xml version="1.0"?>
<DataDesc xmlns:xsi="http://www.w3.org/2001/XMLSchema-instance" xsi:schemaLocation="file:// ../../Xml/schemas/SensorData.xsd">
  <groupArray count="2">
    <group name="Channel">
      <float>G</float>
      <float>P</float>
      <float>Q</float>
      <float>V</float>
      <float>M</float>
      <float>t</float>
    </group>
  </groupArray>
  <float>tCW</float>
  <uint32>error</uint32>
</DataDesc>